Key,English,Spanish
PROPQUEST_REQUESTBOX_INC_000354,A request for $QUEST_END_ITEM_NAME$s has gone out. Will you accept this quest?,Hemos recibido un pedido de $QUEST_END_ITEM_NAME$s para hacer vendajes de tratamiento medico para los pacientes. ¿Aceptas esta misión?
PROPQUEST_REQUESTBOX_INC_000359,A request for Grrr Bandages has gone out.,Hemos recibido un pedido de Vendajes de Grrr para hacer vendajes de tratamiento médico para los pacientes.
PROPQUEST_REQUESTBOX_INC_000370,A request for Amperes has gone out,Hemos recibido un pedido de Amperes. Es el material radioactivo que los Enanos necesitan para trabajar por las noches.
PROPQUEST_REQUESTBOX_INC_000453,A request has gone out for Boopoison to make an antidote. Will you help?,Hemos recibido un pedido de Veneno de Boo para crear un antídoto. ¿Aceptas esta misión?
PROPQUEST_REQUESTBOX_INC_000458,A request has gone out for $QUEST_END_ITEM_NAME$.,Hemos recibido un pedido de $QUEST_END_ITEM_NAME$s para crear un antídoto.
PROPQUEST_REQUESTBOX_INC_000519,A request has gone out for Rootioe to be used as woodworking material. Will you help?,"Hemos recibido un pedido de Rootioe, que se utiliza como material substituto a los materiales de la carpintería, porque se están acabando. ¿Aceptas esta misión?"
PROPQUEST_REQUESTBOX_INC_000366,You can get $QUEST_END_ITEM_NAME$ from any type of $QUEST_END_ITEM_MON$.,Puedes conseguir $QUEST_END_ITEM_NAME$ de cualquier tipo de $QUEST_END_ITEM_MON$.
PROPQUEST_REQUESTBOX_INC_000322,You can collect $QUEST_END_ITEM_NAME$ from all types of $QUEST_END_ITEM_MON$.,Puedes conseguir $QUEST_END_ITEM_NAME$ de todos los tipos de $QUEST_END_ITEM_MON$.
PROPQUEST_REQUESTBOX_INC_000014,You can collect $QUEST_END_ITEM_NAME$ near a bridge in north.,Puedes recolectar $QUEST_END_ITEM_NAME$ cerca del puente que hay al norte.
PROPQUEST_REQUESTBOX_INC_000025,You can collect Unknown Certificates near the Bangs.,Puedes recolectar Certificados Desconocidos cerca de los Bangs.
PROPQUEST_REQUESTBOX_INC_000091,You can collect nyanyang near the Giant Nyangnyang.,Puedes recolectar Nyanyang cerca de la Nyangnyang Gigante.
PROPQUEST_REQUESTBOX_INC_000146,You can collect the office documents near Mias.,Puedes recolectar los Documentos de Oficina cerca de las Mias.
PROPQUEST_REQUESTBOX_INC_000301,You do not want to collect them? Okay.,¿No quieres recolectarlos? Vale.
PROPQUEST_REQUESTBOX_INC_000369,You need more $QUEST_END_ITEM_NAME$.,Necesitas más $QUEST_END_ITEM_NAME$s.
PROPQUEST_REQUESTBOX_INC_000303,You do not have enough $QUEST_END_ITEM_NAME$.,No tienes suficientes $QUEST_END_ITEM_NAME$s.
PROPQUEST_REQUESTBOX_INC_000049,Well done. You have successfully completed the quest.,Bien hecho. Has completado la misión con éxito.
PROPQUEST_REQUESTBOX_INC_000357,Good Job! You successfully completed the quest. Take this for your trouble.,¡Buen trabajo! ¡Has completado la misión con éxito! Toma esto por los problemas ocasionados.
PROPQUEST_REQUESTBOX_INC_000362,$QUEST_END_NPC_NAME$ was happy that the quest was completed.,$QUEST_END_NPC_NAME$ esta feliz de que se haya completado la misión.
PROPQUEST_REQUESTBOX_INC_000307,$QUEST_END_NPC_NAME$ was happy to see the quest completed.,$QUEST_END_NPC_NAME$ se alegra de ver la que la misión está completada.
PROPQUEST_REQUESTBOX_INC_000582,$QUEST_END_NPC_NAME$ is very grateful to you for completing this quest.,$QUEST_END_NPC_NAME$ está muy agradecida contigo por haber completado esta misión.
PROPQUEST_REQUESTBOX_INC_000001,Party of Is,La Fiesta de Is
PROPQUEST_REQUESTBOX_INC_000002,Is needs you to gather Chupim for her party. Will you help?,Is necesita que consigas Chupims para su fiesta. ¿Ayudarás?
PROPQUEST_REQUESTBOX_INC_000007,Is asking you to collect Chupim for her party.,Is quiere que consigas Chupims para su fiesta.
PROPQUEST_REQUESTBOX_INC_000012,Unknown Situation (1),Situación Desconocida (1)
PROPQUEST_REQUESTBOX_INC_000013,Flaris Pang needs you collect unknown letters. Will you help?,El Pang de Flaris necesita Cartas Desconocidas. ¿Aceptas esta misión?
PROPQUEST_REQUESTBOX_INC_000018,Flaris Pang wants you to collect $QUEST_END_ITEM_NAME$.,El Pang de Flaris quiere $QUEST_END_ITEM_NAME$s.
PROPQUEST_REQUESTBOX_INC_000024,Flaris Pang needs you to collect Unknown Certificates. Will you help?,El Pang de Flaris necesita Certificados Desconocidos. ¿Aceptas esta misión?
PROPQUEST_REQUESTBOX_INC_000034,Flying Board,Tabla Voladora
PROPQUEST_REQUESTBOX_INC_000035,Dior needs you to collect Peakyrinds. Will you help?,Dior necesita que consigas Peakyrinds para la producción en masa de Tablas Voladoras. ¿Ayudarás?
PROPQUEST_REQUESTBOX_INC_000040,Dior wants you to collect Peakyrinds.,Dior quiere que consigas Peakyrinds para la producción en masa de Tablas Voladoras.
PROPQUEST_REQUESTBOX_INC_000045,Fresh Start for Mop,Nuevo Comienzo para Mop
PROPQUEST_REQUESTBOX_INC_000046,House of Children needs you to collect Mop for their children. Will you help?,La Casa de Niños necesita Mops. ¿Aceptas esta misión?
PROPQUEST_REQUESTBOX_INC_000051,House of Children wants you to collect 3 Mop.,La Casa de Niños quiere que consigas 3 Mops.
PROPQUEST_REQUESTBOX_INC_000056,Gems for Wands,Gemas para Varitas
PROPQUEST_REQUESTBOX_INC_000057,Madrigal Magician Union wants you to collect Poporam for their wands. Will you help?,La Unión de Magicians de Madrigal necesita Poporams para fabricar sus Varitas. ¿Les ayudarás?
PROPQUEST_REQUESTBOX_INC_000062,Madrigal Magician Union wants you to collect 4 Poporam.,La Unión de Magicians de Madrigal quiere que consigas 4 Poporams para fabricar Varitas.
PROPQUEST_REQUESTBOX_INC_000067,"Cookie Machine, Valin Baget",La Máquina de Galletas de Valin Baget
PROPQUEST_REQUESTBOX_INC_000068,Valin needs you to collect Slain to fuel his Cookie Machine. Will you help?,Valin necesita Slains para fabricar combustible para su Máquina de Galletas. ¿Aceptas esta misión?
PROPQUEST_REQUESTBOX_INC_000073,Valin needs you to collect Slain for his cookie machine.,Valin necesita Slains para fabricar combustible para su Máquina de Galletas.
PROPQUEST_REQUESTBOX_INC_000078,Magic Quill,Pluma Mágica
PROPQUEST_REQUESTBOX_INC_000079,Mule wants you to collect Tarin roots so he can make a new magic quill. Will you help?,Mule quiere que consigas Raíces Tarin para poder hacer una nueva pluma mágica. ¿Le ayudarás?
PROPQUEST_REQUESTBOX_INC_000084,Mule needs you to collect Tarin roots.,Mule necesita Raíces Tarin para crear una nueva Pluma Mágica.
PROPQUEST_REQUESTBOX_INC_000089,Lyangglatang,Lyangglatang
PROPQUEST_REQUESTBOX_INC_000090,Rooney wants you to collect Nyanyangs for her party. Will you help?,Rooney quiere que consigas Nyanyangs para su fiesta. ¿Ayudarás?
PROPQUEST_REQUESTBOX_INC_000095,Rooney needs you to collect Nyanyangs.,Rooney necesita que consigas Nyanyangs para su fiesta.
PROPQUEST_REQUESTBOX_INC_000100,10 Year anniversary gift,El regalo del décimo aniversario
PROPQUEST_REQUESTBOX_INC_000101,Marche wants you to collect Starstones to make a 10 year anniversary gift. Will you help?,Marche quiere que consigas Piedras Estelares para hacer un regalo de décimo aniversario. ¿La ayudarás?
PROPQUEST_REQUESTBOX_INC_000106,Marche needs Starstones,Marche necesita Piedras Estelares para hacer un regalo de décimo aniversario.
PROPQUEST_REQUESTBOX_INC_000111,Liquor for Dunkan,El Licor de Dunkan
PROPQUEST_REQUESTBOX_INC_000112,Dunkan needs you to collect Golden Wings to make a new liquor. Will you help?,Dunkan necesita Alas Doradas para hacer un nuevo licor. ¿Le ayudarás?
PROPQUEST_REQUESTBOX_INC_000117,Dunkan wants Golden Wings.,Dunkan quiere Alas Doradas para hacer un nuevo licor.
PROPQUEST_REQUESTBOX_INC_000122,Sweet Dessert,Un Postre muy Dulce
PROPQUEST_REQUESTBOX_INC_000123,Damian needs you to collect Blue Honey to make a new dessert. Will you help?,Damian necesita Miel Azul para hacer un postre nuevo. ¿Aceptas esta misión?
PROPQUEST_REQUESTBOX_INC_000128,Damian needs Blue Honey,Damian necesita Miel Azul para hacer un postre nuevo.
PROPQUEST_REQUESTBOX_INC_000133,Blessed Doll,Muñeca Bendecida
PROPQUEST_REQUESTBOX_INC_000134,House of Children needs you to collect Mia Dolls as presents for the children. Will you help?,La Casa de Niños necesita Muñecas Mia para hacer regalos a sus niños. ¿Aceptas esta misión?
PROPQUEST_REQUESTBOX_INC_000139,House of Children wants Mia Dolls.,La Casa de Niños quiere Muñecas Mia para hacer regalos a sus niños.
PROPQUEST_REQUESTBOX_INC_000144,Lost Documents,Documentos Perdidos
PROPQUEST_REQUESTBOX_INC_000145,Julia needs you to collect office documents stolen by the Mias. Will you help?,Julia necesita recuperar unos Documentos de Oficina que han robado las Mias. ¿Aceptas esta misión?
PROPQUEST_REQUESTBOX_INC_000150,Julia wants the office documents that the mia stole.,Julia necesita recuperar los Documentos de Oficina que han robado las Mias.
PROPQUEST_REQUESTBOX_INC_000155,Brightly Burning Flame,El Fuego Quema
PROPQUEST_REQUESTBOX_INC_000156,Bozman needs you to collect furious matches to use at his blast furnace. Will you help?,Bozman necesita Cerillas Furiosas para usarlas en su horno. ¿Aceptas esta misión?
PROPQUEST_REQUESTBOX_INC_000161,Bozman wants furious matches,Bozman quiere Cerillas Furiosas para usarlas en su horno.
PROPQUEST_REQUESTBOX_INC_000166,Unknown Situation (2),Situacion Desconocida (2)
PROPQUEST_REQUESTBOX_INC_000167,Flaris Pang needs you to collect unknown letters.,El Pang de Flaris necesita Cartas Desconocidas. ¿Aceptas esta misión?
PROPQUEST_REQUESTBOX_INC_000172,Flaris Pang needs unknown letters again.,El Flaris Pang necesita Cartas Desconocidas otra vez.
PROPQUEST_REQUESTBOX_INC_000177,Delicious Sauce,Una Salsa Deliciosa
PROPQUEST_REQUESTBOX_INC_000178,Kalin needs you to collect Cardrin to make delicious sauce.,Kalin necesita Cardrins para hacer una deliciosa salsa.
PROPQUEST_REQUESTBOX_INC_000183,Kalin wants Cardrin.,Kalin quiere Cardrins para hacer una deliciosa salsa.
PROPQUEST_REQUESTBOX_INC_000188,Magic Orb,Orbe Magico
PROPQUEST_REQUESTBOX_INC_000189,Martin needs Hammarble to make a Magic Orb. Will you help?,Martin necesita Hammarbles para fabricar un Orbe Mágico. ¿Le ayudarás?
PROPQUEST_REQUESTBOX_INC_000194,Martin wants Hammarbles.,Martin quiere Hammarbles para fabricar un Orbe Mágico.
PROPQUEST_REQUESTBOX_INC_000199,Mark of Bill,La Marca de Bill
PROPQUEST_REQUESTBOX_INC_000200,Bill needs you to collect Gigglande so that he can make his mark. Will you help?,Bill necesita Gigglandes para crear su marca. ¿Aceptas esta misión?
PROPQUEST_REQUESTBOX_INC_000205,Bill wants Gigglande.,Bill quiere Gigglandes para crear su marca.
PROPQUEST_REQUESTBOX_INC_000210,Repair Work on Saint Hall,Trabajo de Reparación en el Ayuntamiento de Saint
PROPQUEST_REQUESTBOX_INC_000211,Helena needs you to collect Crescent Stones to repair Saint Hall. Will you help?,Helena necesita Piedras Crecientes para reparar el Ayuntamiento de Saint. ¿Ayudarás?
PROPQUEST_REQUESTBOX_INC_000216,Helena wants $QUEST_END_ITEM_NAME$.,Helena quiere $QUEST_END_ITEM_NAME$s para reparar el Ayuntamiento de Saint.
PROPQUEST_REQUESTBOX_INC_000221,Helping injured animals,Ayuda a los animales heridos
PROPQUEST_REQUESTBOX_INC_000222,Madrigal Animal Association needs you to collect Bobands to help their injured animals. Will you help?,La Asociación de Animales de Madrigal necesita Bobands para ayudar a los animales heridos. ¿Aceptas esta misión?
PROPQUEST_REQUESTBOX_INC_000227,Madrigal Animal Association wants Bobands.,La Asociación de Animales de Madrigal quiere Bobands para ayudar a los animales heridos.
PROPQUEST_REQUESTBOX_INC_000232,Strange Collector,Un Coleccionista Extraño
PROPQUEST_REQUESTBOX_INC_000233,Strange Collector needs you to collect Dumblings for his collection. Will you help?,El Coleccionista Extraño necesita Dumblings para su colección. ¿Aceptas esta misión?
PROPQUEST_REQUESTBOX_INC_000243,For the Wife,Para la Esposa
PROPQUEST_REQUESTBOX_INC_000244,Mayer needs Kalin to make a present for his wife. Will you help?,Mayer necesita Kalins para hacerle un regalo a su esposa. ¿Aceptas esta misión?
PROPQUEST_REQUESTBOX_INC_000249,Mayer wants Kalin.,Mayer quiere Kalins para hacerle un regalo a su esposa.
PROPQUEST_REQUESTBOX_INC_000254,Weak Heart,Corazón Débil
PROPQUEST_REQUESTBOX_INC_000255,Helena needs clock hearts to make a new heart for her sick brother. Will you help?,Helena necesita Corazones del Tiempo para hacerle un corazón nuevo a su hermano enfermo. ¿Aceptas esta misión?
PROPQUEST_REQUESTBOX_INC_000265,Devil Marble,Mármol del Demonio
PROPQUEST_REQUESTBOX_INC_000266,Bill needs Tomb Marbles to make the Devil Marble. Will you help?,Bill necesita Tumbas de Mármol para fabricar mármol del demonio. ¿Aceptas esta misión?
PROPQUEST_REQUESTBOX_INC_000271,Bill wants Tomb Marbles.,Bill quiere Tumbas de Mármol para fabricar el mármol del demonio.
PROPQUEST_REQUESTBOX_INC_000276,Dream of the Fighter,El Sueño de todo Guerrero
PROPQUEST_REQUESTBOX_INC_000277,Fighter needs you to collect Golden Fists to make a golden glove. Will you help?,Los Guerreros necesitan Puños Dorados para hacer un guante de oro. ¿Aceptas esta misión?
PROPQUEST_REQUESTBOX_INC_000282,Fighter wants Golden Fists.,Los Guerreros quieren Puños Dorados para hacer un guante de oro.
PROPQUEST_REQUESTBOX_INC_000287,Marbles for the Son,Canicas para el Hijo
PROPQUEST_REQUESTBOX_INC_000288,Mayer needs orbin to make marbles for his son. Will you help?,Mayer necesita Orbrins para hacer canicas para su hijo. ¿Aceptas esta misión?
PROPQUEST_REQUESTBOX_INC_000293,Mayer wants orbin.,Mayer quiere Orbrins para hacer canicas para su hijo.
PROPQUEST_REQUESTBOX_INC_000298,Strange Collector (2),Un Coleccionista Extraño (2)
PROPQUEST_REQUESTBOX_INC_000299,Strange Collector needs you to collect $QUEST_END_ITEM_NAME$ for his collection. Will you help?,El Coleccionista Extraño necesita $QUEST_END_ITEM_NAME$ para su colección. ¿Aceptas esta misión?
PROPQUEST_REQUESTBOX_INC_000304,Strange Collector wants $QUEST_END_ITEM_NAME$.,El Coleccionista Extraño quiere $QUEST_END_ITEM_NAME$s para su colección.
PROPQUEST_REQUESTBOX_INC_000309,Lens of Olien,Lentes para Olien
PROPQUEST_REQUESTBOX_INC_000310,Olien needs you to collect steam tears to make a new lens. Will you help?,Olien necesita Lágrimas de Vapor para crear sus nuevas lentes. ¿Aceptas esta misión?
PROPQUEST_REQUESTBOX_INC_000315,Olien wants steam tears.,Olien quiere Lágrimas de Vapor para crear sus nuevas lentes.
PROPQUEST_REQUESTBOX_INC_000320,Red Muffler,Bufandas Rojas
PROPQUEST_REQUESTBOX_INC_000321,Soldier needs you to collect knightlers to make a new scarf. Will you help?,Los soldados necesitan Knightlers para hacer unas nuevas bufandas. ¿Aceptas esta misión?
PROPQUEST_REQUESTBOX_INC_000326,Soldier wants knightler.,Los soldados quieren Knightlers para hacer unas bufandas nuevas.
PROPQUEST_REQUESTBOX_INC_000331,Dwarpet Festival,El Festival de los Enanos
PROPQUEST_REQUESTBOX_INC_000332,The Dwarpet needs you to collect wheeshoes for their festival. Will you help?,Los Enanos necesitan Wheeshoes para su festival. ¿Aceptas esta misión?
PROPQUEST_REQUESTBOX_INC_000337,The Dwarpet wants wheesoes.,Los Enanos quieren Wheeshoes para usarlos en su festival.
PROPQUEST_REQUESTBOX_INC_000342,Crane Repair,Reparación de la Grúa
PROPQUEST_REQUESTBOX_INC_000343,The Erons Industrial Manager needs Droil to repair their crane. Will you help?,El Gerente Industrial de Erons necesita Droils para reparar su grúa. ¿Aceptas esta misión?
PROPQUEST_REQUESTBOX_INC_000348,Erons want Droils.,El Gerente Industrial de Erons quiere Droils para reparar su grúa.
PROPQUEST_REQUESTBOX_INC_000353,Urgently looking for a Bandage,Buscando un Vendaje con urgencia
PROPQUEST_REQUESTBOX_INC_000364,Portable Power,Poder Portátil
PROPQUEST_REQUESTBOX_INC_000375,Strange Collector (3),Un Coleccionista Extraño (3)
PROPQUEST_REQUESTBOX_INC_000386,Replacement Tires,Neumáticos de repuesto
PROPQUEST_REQUESTBOX_INC_000387,The Dwarpet needs you to collect Dumptires to replace his flat tires. Will you help?,Los Enanos necesitan Neumáticos de Dump para reemplazar sus llantas. ¿Aceptas esta misión?
PROPQUEST_REQUESTBOX_INC_000392,The Dwarpet wants Dumptire.,Los Enanos quieren Neumáticos de Dump para reemplazar sus llantas.
PROPQUEST_REQUESTBOX_INC_000397,Strange Collector (4),Un Coleccionista Extraño (4)
PROPQUEST_REQUESTBOX_INC_000398,Mysterious collector needs Garbageton for his collection. Will you help?,El Coleccionista Extraño necesita Garbagetons para su colección. ¿Aceptas esta misión?
PROPQUEST_REQUESTBOX_INC_000408,Relics of a Husband,Reliquias del Marido
PROPQUEST_REQUESTBOX_INC_000409,A widow has asked that you collect Eronior so that she can re-make the ring of her husband. Will you help?,Una viuda ha pedido Eroniors para poder rehacer el anillo de su marido. ¿Aceptas esta misión?
PROPQUEST_REQUESTBOX_INC_000414,A widow wants some Eronior.,Una viuda quiere Eroniors para rehacer el anillo de su marido.
PROPQUEST_REQUESTBOX_INC_000419,Disguise of Remina,El Disfraz de Remina
PROPQUEST_REQUESTBOX_INC_000420,Remina needs you to collect repygle to make a pair of disguising sunglasses. Will you help?,Remina necesita Repygles para hacer un par de gafas de sol para un disfraz. ¿Aceptas esta misión?
PROPQUEST_REQUESTBOX_INC_000425,Remina wants $QUEST_END_ITEM_NAME$.,Remina quiere $QUEST_END_ITEM_NAME$s para hacer un par de gafas para un disfraz.
PROPQUEST_REQUESTBOX_INC_000430,Beautiful Keil Wallpaper,Un papel de pared hermoso
PROPQUEST_REQUESTBOX_INC_000431,Haven needs you to collect Sycale to re-model the Magic Shop. Will you help?,Heaven necesita Sycales para reformar las paredes de su Tienda de Magia. ¿Aceptas esta misión?
PROPQUEST_REQUESTBOX_INC_000436,Heaven wants Sycale.,Heaven quiere Sycales para reformar las paredes de su Tienda de Magia.
PROPQUEST_REQUESTBOX_INC_000441,Strange Collector (5),Un Coleccionista Extraño (5)
PROPQUEST_REQUESTBOX_INC_000442,Strange Collector needs $QUEST_END_ITEM_NAME$ for his collection. Will you help?,El Coleccionista Extraño necesita $QUEST_END_ITEM_NAME$s para su colección. ¿Aceptas esta misión?
PROPQUEST_REQUESTBOX_INC_000447,Strange collector want Mong Tear,El Coleccionista Extraño quiere Lágrimas Mong para su colección.
PROPQUEST_REQUESTBOX_INC_000452,Anesthetic Needs,Se necesitan Anestésicos
PROPQUEST_REQUESTBOX_INC_000463,New Kind of Firework,Un nuevo tipo de Fuegos Artificiales
PROPQUEST_REQUESTBOX_INC_000464,The Fireworks Producer needs Bomb Timers to make a new kind of firework. Will you help?,Un productor de Fuegos Artificiales necesita Temporizadores de Bomba para su nuevo tipo de Fuegos Artificiales. ¿Aceptas esta misión?
PROPQUEST_REQUESTBOX_INC_000465,You get bombtimers from any type of Carrierbomb.,Puedes conseguir Temporizadores de Bomba de cualquier tipo de Carrierbomb.
PROPQUEST_REQUESTBOX_INC_000469,The Firework Producer wants Bomb Timers.,Un productor de Fuegos Artificiales quiere Temporizadores de Bomba para sus nuevos productos.
PROPQUEST_REQUESTBOX_INC_000474,Snack for the Children,Picoteo para los Niños
PROPQUEST_REQUESTBOX_INC_000475,Bolpor needs Prewing to make some snacks for the children. Will you help?,Bolpor necesita Prewings para cocinar algo de picoteo para los niños. ¿Aceptas esta misión?
PROPQUEST_REQUESTBOX_INC_000480,Bolpor wants Prewing.,Bolpor quiere Prewings para cocinar algo de picoteo para los niños.
PROPQUEST_REQUESTBOX_INC_000485,Mushroom Farm of Chitller,La Granja de Setas de Chitller
PROPQUEST_REQUESTBOX_INC_000486,Chitller needs you to collect Poiespore for his mushroom farm will you help?,"Chitller necesita Poiespores para su granja de setas, ¿Aceptas esta misión?"
PROPQUEST_REQUESTBOX_INC_000491,Chitller wants Poiespore.,Chitller quiere Poiespores para su granja de setas.
PROPQUEST_REQUESTBOX_INC_000496,New Yo-Yo,Yo-Yo Nuevo
PROPQUEST_REQUESTBOX_INC_000497,An Acrobat master needs you to gather Renyken to make a new Yo-Yo. Will you help?,Un Maestro Acrobat necesita Renykens para crear un nuevo Yo-Yo. ¿Aceptas esta misión?
PROPQUEST_REQUESTBOX_INC_000502,An Acrobat master wants Renyken.,Un Maestro Acrobat quiere Renykens para crear un nuevo Yo-Yo.
PROPQUEST_REQUESTBOX_INC_000507,Disguise of a Native,Disfraces para los Nativos
PROPQUEST_REQUESTBOX_INC_000508,Darkon natives need you to collect Tangkask. Will you help?,Los nativos de Darkon necesitan Tangkasks para escapar de los peligrosos Watangka. ¿Aceptas esta misión?
PROPQUEST_REQUESTBOX_INC_000513,Darkon natives want Tankask.,Los nativos de Darkon quieren Tangkasks para escapar de los peligrosos Watangka.
PROPQUEST_REQUESTBOX_INC_000518,Woodworking Material,Material para la Carpinteria
PROPQUEST_REQUESTBOX_INC_000529,The Best Shield,El Mejor Escudo
PROPQUEST_REQUESTBOX_INC_000530,Remina needs Luchest to make the strongest shield in the world. Will you help?,Remina nos ha pedido recolectar algunos Luchest para hacer el escudo más fuerte del mundo. ¿Aceptas esta misión?
PROPQUEST_REQUESTBOX_INC_000540,Beauty Contest Award,Premio para el Concurso de Belleza
PROPQUEST_REQUESTBOX_INC_000541,The Madrigal Beauty Contest needs Eronsimint for making an award. Will you help?,Se necesitan Eronsimints para los premios del Concurso de Belleza de Madrigal. ¿Aceptas esta misión?
PROPQUEST_REQUESTBOX_INC_000546,The Madrigal Beauty Contest sponsor wants Eronsimint.,Consigue Eronsimints para los premios del Concurso de Belleza de Madrigal.
PROPQUEST_REQUESTBOX_INC_000551,Lucky Tool,La Herramienta de Lucky
PROPQUEST_REQUESTBOX_INC_000552,Lucky needs Hammamer to make a lucky hammer. Will you help?,Lucky necesita Hammamers para crear un martillo de la suerte. ¿Aceptas esta misión?
PROPQUEST_REQUESTBOX_INC_000557,Lucky wants Hammamer.,Lucky quiere Hammamers para crear un martillo de la suerte.
PROPQUEST_REQUESTBOX_INC_000562,Strange Collector (6),Un Coleccionista Extraño (6)
PROPQUEST_REQUESTBOX_INC_000573,Request of Lurif,El Pedido de Lurif
PROPQUEST_REQUESTBOX_INC_000574,Could you do me a favor? I need Phanbubble. Can you help me please?,¿Puedes hacerme un favor? Necesito Phanbubbles. ¿Puedes ayudarme por favor?
PROPQUEST_REQUESTBOX_INC_000579,Lurif needs many Phanbubbles.,Lurif necesita muchos Phanbubbles.
PROPQUEST_REQUESTBOX_INC_000815,Mysterious Magic Material,Material Mágico Misterioso
PROPQUEST_REQUESTBOX_INC_000816,Magician Master requested you to collect Merahook which is a magic material. Will you accept this request?,"La Maestra Magician quiere Merahooks, que es un material mágico. ¿Aceptas esta misión?"
PROPQUEST_REQUESTBOX_INC_000817,You can collect them from the group of Chimeradon in the Deadwallderness.,Puedes conseguirlos del grupo de Chimeradons que hay en el Desierto Muerto.
PROPQUEST_REQUESTBOX_INC_000826,Avenge Nerky,Venganza Nerky
PROPQUEST_REQUESTBOX_INC_000827,Krinton's pet Bearnerky got killed by the other Bearnerky. Krinton requested you to collect NerkyMane for revenge. Will you accept this request?,La mascota Bearnerky de Krinton ha sido asesinado por otro Bearnerky. Krinton quiere Nerkymanes para vengarse. ¿Aceptas esta misión?
PROPQUEST_REQUESTBOX_INC_000828,You can collect them from the group of Bearnerky in the Deadwallderness.,Puedes conseguirlos del grupo de Bearnerky que hay en el Desierto Muerto.
PROPQUEST_REQUESTBOX_INC_000837,Bolpor's favor,Un favor para Bolpor
PROPQUEST_REQUESTBOX_INC_000838,Bolpor requested you to collect Rincruet for making some special food. Will you accept this request?,Bolpor necesita Rincruets para hacer una comida especial. ¿Aceptas esta misión?
PROPQUEST_REQUESTBOX_INC_000839,You can collect them from the group of Muffrin in the Deadwallderness.,Puedes conseguirlos del grupo de Muffrin que hay en el Desierto Muerto.
PROPQUEST_REQUESTBOX_INC_000848,Toy Materials,Materiales para los Juguetes
PROPQUEST_REQUESTBOX_INC_000849,A toy merchant requested you to collect Popshift for making fancy toys. Will you accept this request?,Un mercader de juguetes necesita Popshifts para hacer unos juguetes de lujo. ¿Aceptas esta misión?
PROPQUEST_REQUESTBOX_INC_000850,You can collect them from the group of Popcrank in the Deadwallderness.,Puedes conseguirlos del grupo de Popcrank que hay en el Desierto Muerto.
PROPQUEST_REQUESTBOX_INC_000859,Evil Eyed Red Dragon,Dragón Rojo de Ojos Malvados
PROPQUEST_REQUESTBOX_INC_000860,Can you please go find Dragon Tooth of the Meteonyker Dragon for me? The Arena Manager Lay requested 5 of them.,¿Puedes ir a buscar los Colmillos de Dragón del Meteonyker para mí? El Mánager de la Arena Lay ha solicitado 5 de ellos.
PROPQUEST_REQUESTBOX_INC_000861,"You can collect them from Meteonyker. I heard it's in Dekane Dungeon. Be careful, the Meteonyker is very strong! It's  best if you go with a party!",Los puedes conseguir derrotando al Meteonyker. Escuché que está en la Mina Dekane. ¡Ten cuidado! ¡El Meteonyker es muy fuerte! ¡Mejor que vayas con más gente!
PROPQUEST_REQUESTBOX_INC_010000,Moth Infestation,Plaga de Polillas
PROPQUEST_REQUESTBOX_INC_010001,Tina asked for help with reducing the Mothbee population as they're causing problems with transport. Could you kill 15 of them?,"Tina ha pedido ayuda para reducir la población de Mothbees, ya que están causando problemas con el transporte. ¿Podrías eliminar a 15?"
PROPQUEST_REQUESTBOX_INC_010002,You can find Mothbee flying inbetween Northern Saint City & Flaris.,Puedes encontrar a las Mothbees volando entre el Norte de Saint City y Flaris.
PROPQUEST_REQUESTBOX_INC_010003,You don't want to help? That's okay. We'll find somebody else.,¿No quieres ayudar? De acuerdo. Encontraremos a otra persona.
PROPQUEST_REQUESTBOX_INC_010004,You haven't finished the task yet.,Aún no has terminado la tarea.
PROPQUEST_REQUESTBOX_INC_010005,Mutated Aibatts,Aibatts Mutados
