Key,English,Portuguese
PROPQUEST_REQUESTBOX_INC_020081,The Magic Skulls of the Redcloud,The Magic Skulls of the Redcloud
PROPQUEST_REQUESTBOX_INC_020082,The Redcloud generate a mysterious energy within their skulls. Muran shamans want to study this magic to reinforce the city's protective wards.,The Redcloud generate a mysterious energy within their skulls. Muran shamans want to study this magic to reinforce the city's protective wards.
PROPQUEST_REQUESTBOX_INC_020083,Very well! Their skulls contain a mysterious energy. We must study it. Bring back 325 $QUEST_END_ITEM_NAME$ from the Redcloud.,Very well! Their skulls contain a mysterious energy. We must study it. Bring back 325 $QUEST_END_ITEM_NAME$ from the Redcloud.
PROPQUEST_REQUESTBOX_INC_020084,Alright… but this magic could strengthen our defenses.,Alright… but this magic could strengthen our defenses.
PROPQUEST_REQUESTBOX_INC_020085,You don’t have enough energy-charged skulls yet. Keep going!,You don’t have enough energy-charged skulls yet. Keep going!
PROPQUEST_REQUESTBOX_INC_020086,Excellent work! These skulls are a true source of power.,Excellent work! These skulls are a true source of power.
PROPQUEST_REQUESTBOX_INC_020087,The Devil’s Teeth,The Devil’s Teeth
PROPQUEST_REQUESTBOX_INC_020088,A strange corruption spreads through Kaillun as Devil Spirits multiply. Their teeth contain a demonic essence the sages wish to seal away.,A strange corruption spreads through Kaillun as Devil Spirits multiply. Their teeth contain a demonic essence the sages wish to seal away.
PROPQUEST_REQUESTBOX_INC_020089,Be brave! The Devil Spirits are growing in number. Their teeth must be sealed. Bring back 325 $QUEST_END_ITEM_NAME$ from the Devil Spirits.,Be brave! The Devil Spirits are growing in number. Their teeth must be sealed. Bring back 325 $QUEST_END_ITEM_NAME$ from the Devil Spirits.
PROPQUEST_REQUESTBOX_INC_020090,I understand… but their influence spreads further each night. Return carefully.,I understand… but their influence spreads further each night. Return carefully.
PROPQUEST_REQUESTBOX_INC_020091,Not enough teeth to contain the demonic energy yet. Keep gathering.,Not enough teeth to contain the demonic energy yet. Keep gathering.
PROPQUEST_REQUESTBOX_INC_020092,Very good! These teeth will be purified and neutralized. You’ve done us a great service.,Very good! These teeth will be purified and neutralized. You’ve done us a great service.
PROPQUEST_REQUESTBOX_INC_020093,The Bloodstained Fangs of the Hellhound,The Bloodstained Fangs of the Hellhound
PROPQUEST_REQUESTBOX_INC_020094,"Hellhounds roam dangerously close to Kaillun, and their bloodied fangs leave lingering wounds. The Muran need them to forge weapons capable of driving these beasts back.","Hellhounds roam dangerously close to Kaillun, and their bloodied fangs leave lingering wounds. The Muran need them to forge weapons capable of driving these beasts back."
PROPQUEST_REQUESTBOX_INC_020095,Perfect! Their blood-soaked fangs are deadly. Bring back 325 $QUEST_END_ITEM_NAME$ from the Hellhounds to us for forging.,Perfect! Their blood-soaked fangs are deadly. Bring back 325 $QUEST_END_ITEM_NAME$ from the Hellhounds to us for forging.
PROPQUEST_REQUESTBOX_INC_020096,Very well… but the Hellhounds still lurk around Kaillun.,Very well… but the Hellhounds still lurk around Kaillun.
PROPQUEST_REQUESTBOX_INC_020097,You don’t have enough. Their fangs are essential to forge weapons that can repel them.,You don’t have enough. Their fangs are essential to forge weapons that can repel them.
PROPQUEST_REQUESTBOX_INC_020098,"Excellent work! Thanks to you, we can forge weapons worthy of the finest Muran warriors.","Excellent work! Thanks to you, we can forge weapons worthy of the finest Muran warriors."
PROPQUEST_REQUESTBOX_INC_020099,$QUEST_END_NPC_NAME$ thanks you from the bottom of his heart! Glory to the Murans!,$QUEST_END_NPC_NAME$ thanks you from the bottom of his heart! Glory to the Murans!
